40,Juego del Gato,0,0,1,1,0,1,0,1,1,1,1,1,3,5,15,95,863,4.0,la idea es que se pueda jugar contra el computador y que sea interesante jugar contra él para lograrlo crea la clase juegodelgato con los siguientes métodos jugargatoselffilacolumna asigna la fila y columna indicada del tablero al gato retornando true si lo pudo hacer y false si es que no jugarratonself el ratón debe escoger la jugada más inteligente según la configuración del tablero el método debe retornar true si pudo jugar y false si es que no mostrar_tableroself debe retornar una matriz de 3x3 donde un 0 es una celda vacía un 1 es un gato y un 1 es un ratón no es necesario que uses internamente esa codificación cargar_tableroselfmatriz reemplaza tu tablero de acuerdo a la matriz de 3x3 recibida como parámetro con valores 0 1 y 1 indicarestadoself debe retornar 0 si no hay ganador pero se puede seguir jugando 1 si hay empate 2 si ganó el gato 3 si ganó el ratón,6.5,13.0,13.0,11.0,10.0
41,Clase FechaHora,0,0,1,1,0,0,1,0,1,1,1,1,3,2,15,47,815,2.0,crea la clase fechahora con las siguientes características con un método fijarfecha que recibe como argumento un string con formato ddmmaaaa o ddmmaaaa con un método fijarhora que recibe como argumento un string con formato hhmmss con un método fijarfechahora que recibe como argumento un string con formato ddmmaaaa hhmmss se debe poder cambiar cualquier parámetro día hora etc con un método cambiar que reciba como argumento un string que especifica el tipo de parámetro y su valor el cual se debe validar por ejemplo si quiero cambiar el día a 2 debería usar como parámetro dd2 sin importar los espacios y deberíaa aparecer un mensaje cuando por ejemplo quiera cambiar el día a 40 un objeto de la clase fechahora se debe poder mostrar mediante print con la fecha en formato aaaammdd hhmmss,5.5,11.0,11.0,7.0,2.0
42,Números Amigos,0,0,0,1,0,0,0,0,0,0,1,1,1,0,3,3,259,3.0,dos números a y b se dicen números amigos si la suma de los divisores de uno de los números es igual al otro número y viceversa en el cálculo de los divisores no debes considerar al mismo número crea una función que reciba 2 números y retorne true si es que estos son amigos y false si es que no lo son,2.75,9.0,4.0,3.0,0.0
43,Clase Usuario,0,0,1,1,0,0,1,1,1,1,1,1,3,3,15,63,831,2.0,crea la clase usuario que represente a un usuario de un sitio web o red social el cual debe tener como atributos el nombre de usuario nombre la clave clave y email email en el método __init__ se deben recibir como parámetros el nombre y el email pues la clave se debe crear como un string vacío para definir la password del usuario usaremos el método cambiar_passwordself password el cual debe actualizar la clave pero validando que la password del usuario cumpla las siguientes reglas tiene un mínimo de 8 caracteres y un máximo de 16 contiene letras y números y además contiene al menos una letra mayúscula o al menos un carácter especial o sea un símbolo que no sea una letra un por ejemplo si la password del usuario cumple las regla tu función debe actualizar el atributo password y retornar true si la password no cumple alguna de las reglas tu función debe retornar false y no cambiar la clase crea también el método loginselfpassword que retorne true si la password ingresada corresponde a la clase del usuario o false si la clave no corresponde a la clave del usuario,5.25,14.0,13.0,7.0,7.0
44,Números Perfectos,0,0,1,0,0,0,0,1,0,0,1,1,2,1,3,19,531,2.0,un número se dice número perfecto si la suma de todos sus divisores es igual al mismo número no debes considerar como divisor al mismo número crea una función llamada numero_perfecto que reciba un número y retorne true si es un número perfecto y false en caso de no serlo,3.0,8.0,6.0,6.0,4.0
45,Carro de Compras,0,0,1,1,0,0,1,0,1,1,1,1,3,2,15,47,815,3.0,amazon quiere probar el uso de python para su nuevo carro de compras para hacerlo te pide hacer un prototipo en el que los productos estén representados por números del 1 al 5 1 juego pokemon x para nintendo 3ds usd 3377 2 nintendo 3ds xl usd 203 3 juego mario kart 7 para nintendo 3ds usd 2758 4 playstation 4 usd 34800 5 fifa 16 playstation 4 usd 5119 si se agregan los productos 1 2 y 3 al carro se aplica un descuento del 20 del valor conjunto lo mismo ocurre si se agregan los productos 4 y 5 al carro se les aplica un descuento del 15 tu programa debe permitir agregar productos al carro mostrarlos y hacer el checkout para hacerlo debe recibir un string que indica lo que el usuario quiere hacer los productos tu programa debe recibirlos como strings de la forma productocantidad por ejemplo para agregar 2 unidades del producto 5 tu programa recibirá el string 52 para imprimir los productos tu programa recibirá la orden ver para hacer el checkout tu programa recibirá la orden checkout al recibirla tu programa debe imprimir el valor de los productos en el carro considerando los descuentos el precio debe estar redondeado a un decimal importante en este ejercicio tu programa debe recibir los valores con input y luego imprimir el resultado con print como parte de tu programa puedes crear y usar las funciones que necesites,0.0,0.0,0.0,0.0,0.0
46,Pokemon,0,0,1,1,0,0,1,1,1,1,1,1,3,3,15,63,831,2.0,Pokemon,0.0,0.0,0.0,0.0,0.0
47,El problema de la mochila,0,1,0,0,1,1,0,0,0,1,1,1,4,12,7,199,1223,1.0,a través de este buzón pueden entregar el programa que hayan creado en su grupo para el ejercicio en clases lo que entreguen será revisado en forma manual en forma provisoria la plataforma les entregará un punto por entregar su ejercicio pero el puntaje del ejercicio varía entre 1 y 4 puntos todos los integrantes del grupo deben entregar el ejercicio el puntaje será igual para todos y se calculará a partir de la revisión del programa de uno de los integrantes del grupo,0.0,0.0,0.0,0.0,0.0
48,Sopa de Letras,0,0,1,0,0,1,0,1,0,1,1,1,2,5,7,87,599,8.0,crea un programa capaz de resolver el juego conocido como la sopa de letras este juego consiste en un tablero de n x m donde cada posición del tablero tiene una letra el objetivo del juego es encontrar palabras dentro del tablero ya sea en forma horizontal de izquierda a derecha vertical de arriba a abajo o diagonal de esquina superior izquierda a esquina inferior derecha tomando como ejemplo la sopa de letras descrita en este archivo implementa la función sopaletrasnombre_archivopalabras que recibe como parámetro el nombre de un archivo con la sopa de letras en el formato del ejemplo y una lista de palabras a buscar en la sopa de letras la función debe retornar una lista de tuplas con tres valores la palabra tal como la recibe la función en lista de palabras una lista de dos enteros con la fila y columna inicial donde aparece la palabra un string que describe la dirección en la que aparece la palabra derecha abajo diagonal de acuerdo a si la palabra aparece en forma horizontal vertical o diagonal respectivamente por ejemplo la llamada sopaletrassopatxtcasa debería retornar una lista con una tupla de tres elementos casa00derecha,5.75,14.0,13.0,9.0,7.0
49,Caminos entre ciudades,0,0,1,1,0,0,1,0,1,1,1,1,3,2,15,47,815,2.0,crea un programa que reciba como parámetros las coordenadas de 2 ciudades en el plano xy y que genere todos los pasos necesarios para llegar de una ciudad a la otra asume que no hay restricciones sobre el plano y que puedes dar pasos en diagonal tu programa debe imprimir todos los pasos y al final debe imprimir la distancia recorrida para resolver el problema crea la clase ciudad e implementa los métodos camino y distancia p1ciudad11 p2ciudad33 p1caminop2 debiera generar una lista con puntos representados como listas por ejemplo 112233 p1distanciap2 debiera retornar 282,5.0,14.0,8.0,8.0,4.0
50,MCM recursivo,0,1,0,0,0,0,0,1,0,0,1,1,4,1,3,19,1043,2.0,implementa un programa recursivo que calcule el mínimo común múltiplo entre dos números enteros cualesquiera el mcm de un número se puede calcular usando el mcd con la siguiente relación mcmab abmcdab el mcd se puede calcular en forma recursiva usando el algoritmo de euclides para resolver el problema deberán combinar la fórmula que relaciona el mcm con el mcd y el algoritmo de euclides para construir una función recursiva que calcule el mcm hint una forma de hacerlo es crear una función mcm que reciba tres parámetros mcmabab asi si queremos calcular el mcm entre 88 y 44 ejecutaríamos así a la función mcm88448844 la que debería retornar 88,0.0,0.0,0.0,0.0,0.0
51,Combinaciones de Números Binarios,0,1,0,0,1,1,0,0,0,1,1,1,4,12,7,199,1223,3.0,escribe un programa que imprima todos los números binarios de largo n usando backtracking tu programa recibirá a través de input un valor n el largo del número y luego deberá imprimir cada combinación de números binarios no importa el orden en que se impriman las combinaciones lo importante es que se generen todas y que cada una se imprima en una línea separada,0.0,0.0,0.0,0.0,0.0
52,Ornitología 2,0,0,1,1,0,0,0,0,1,0,0,0,3,0,8,8,776,1.0,tu amigo te cuenta que la clasificación de los animales es jerárquica por lo que un taxon puede incluir varios taxones para representar esto agrega el atributo subcategorias a la clase taxon inicializándolo como una lista vacía,4.25,11.0,8.0,4.0,0.0
