id_ejercicio,nombre,h1,h2,h3,h4,s1,s2,s3,s4,k1,k2,k3,k4,hito,skill,knowledge,complexity,complexity12,puntos,enunciado,dificultad,score_a,score_d,score_p,score_s
0,Cálculo del dígito verificador del rut,0,0,0,1,0,0,0,1,0,1,1,1,1,1,7,23,279,2.0,escribe un programa que reciba como dato un número que representará un rut al que debe calcularle el dígito verificador por ejemplo al ingresar 6016740 tu programa debiera imprimir el siguiente mensaje dv0 el algoritmo de cálculo del dígito verificador lo puedes obtener del siguiente link,2.25,10.0,0.0,4.0,2.0
1,Calculadora Geométrica,0,0,1,0,0,0,0,1,0,0,0,1,2,1,1,17,529,2.0,construye un programa que permita calcular el área de un rectángulo un triángulo un rombo y un círculo creando una función específica para cada figura geométrica y con un menú que permita escoger lo que la persona desea calcular importa desde la librería math la constante pi,2.5,8.0,7.0,2.0,0.0
2,Subsecuencias de ADN,0,0,1,0,0,0,1,1,0,1,1,1,2,3,7,55,567,5.0,escribe un programa que reciba como entrada un string y un entero n y que imprima todos los substrings de largo n que aparezcan una única vez dentro de s por ejemplo con el string acgacg y n3 tu programa debe imprimir dos líneas una con cga y otra con gac con el string acgacgac y n3 debe imprimir el mensaje ninguna con el string aaaaa y n3 debe imprimir el mensaje ninguna,5.0,12.0,7.0,8.0,3.0
3,Números Primos,0,0,0,1,0,0,0,0,0,0,1,1,1,0,3,3,259,2.0,escribe una función llamada es_primo que retorne true cuando un número es primo y false cuando no lo es,1.5,7.0,2.0,2.0,0.0
4,Nota Final,0,0,0,1,0,0,0,0,0,0,0,1,1,0,1,1,257,1.0,realiza un programa para preguntar al usuario cuatro notas pt tareas pi interrogaciones ne examen pp presentacion con ellas calcula el promedio final usando la siguiente fórmula 03pt 03pi 03ne 01pp imprime el resultado redondeado a un decimal,1.25,8.0,1.0,2.0,0.0
5,Validador de Expresiones Matemáticas,0,1,0,0,1,0,0,0,0,1,1,1,4,8,7,135,1159,3.0,escribe la función recursiva validar_expresion expresion la que debe revisar si un string que contiene únicamente números naturales y los operadores de suma y resta representa una operación matemática válida o no por ejemplo expresión resultado 23 true 23 true 2 false 2 false 2 false,0.0,0.0,0.0,0.0,0.0
6,Suma de los divisores de un número,0,0,1,0,0,0,0,1,0,0,1,1,2,1,3,19,531,2.0,crea una función que calcule la suma de los divisores de un número sin incluir al número llamada suma_divisores junto con la suma de los divisores haz que la función retorne si el número es primo o no basándose en que si la suma de sus divisores es 1 el número es primo importante en este ejercicio solamente debes entregar funciones que reciben los parámetros indicados en el ejercicio y que entregan su resultado con return los input y los print para probar tu función los debes poner dentro de un if __name__ __main__ o quitarlos del programa al momento de subirlo a la plataforma,3.5,9.0,9.0,7.0,2.0
7,Resolver un sistema de ecuaciones,0,0,0,1,0,0,0,0,0,0,0,1,1,0,1,1,257,1.0,escribe un programa que resuelva un sistema de dos ecuaciones con dos incognitas tu programa recibirá los seis números reales que representan el sistema y deberá imprimir la dos soluciones redondeadas a un decimal ejemplo para el sistema 2x3y6 y x2y5 tu programa debe imprimir x30 y40,3.25,8.0,4.0,2.0,2.0
8,Distancia Levenshtein,0,0,1,0,0,0,1,1,0,1,1,1,2,3,7,55,567,7.0,la distancia levenshtein corresponde al menor número de caracteres que hay que insertar borrar o sustituir para transformar un string a otro por ejemplo las palabras gato y gatito están a distancia 2 pues para llegar de una a otra basta insertar i e insertar t o bien eliminar i y eliminar t las palabras hola y ola están a distancia 1 para llegar de una a otra basta insertar h o borrar h las palabras gallina y gallina están a distancia 0 pues son iguales las palabras caro y cara están a distancia 1 para llegar de una a otra basta sustituir o por a implementa la función levenshtein que recibe dos palabras y retorna los siguientes strings 1 si la distancia es mayor que 1 ib si la distancia es 1 y para llegar de una palabra a la otra hay que insertar o borrar una letra 1s si la distancia es 1 porque hay que sustituir una letra 0d si las palabras son iguales,4.25,13.0,9.0,8.0,4.0
9,Validar Secuencias de ADN,0,0,1,0,0,0,1,0,0,1,1,1,2,2,7,39,551,3.0,escribe un programa que reciba como entrada un string y valide si esa secuencia podría representar una secuencia del genoma el programa no debe distinguir entre mayúsculas y minúsculas si la secuencia podría representar un genoma contiene solamente las letras actg tu programa debe imprimir el mensaje secuencia correcta si la secuencia no es válida tu programa debe imprimir el mensaje secuencia incorrecta,4.5,10.0,7.0,6.0,4.0
10,Descomponer un número,0,0,0,1,0,0,0,0,0,0,1,1,1,0,3,3,259,1.0,escribe un programa que le pida al usuario un número de hasta 4 dígitos y que te entregue la descomposición en unidades decenas centenas y miles ejemplos para 1230 debe imprimir 1m 2c 3d 0u para 36 debe imprimir 3d 6u code editor,2.75,10.0,3.0,4.0,1.0
11,Adivina la palabra,0,0,1,0,0,0,1,0,0,1,1,1,2,2,7,39,551,4.0,el juego consiste en tratar de adivinar una palabra secreta dando algunas letras como pista la persona tiene hasta 7 intentos para adivinar la palabra tu programa debe crear una lista con palabras secretas y escoge aleatoriamente cuál palabra usarás para el juego escoger aleatoriamente cuántas letras mostrar de la palabra secreta de acuerdo a la longitud de la palabra para ocultar las letras crea la función ocultar_letraspalabra cantidad que debe recibir como parámetro la palabra secreta y ocultar la cantidad de letras indicada en posiciones aleatoriamente escogidas reemplazándolas por _ ej ocultar_letraslepidoptero1 podría retornar _epidoptero lep_doptero lepidopter_ etc el jugador debe poder ingresar una letra o arriesgarse a decir la palabra completa para revisar si una letra ingresada por el jugador existe en la palabra crea la función revisar_letrapalabra_secreta palabra letra que verifica si letra existe en la palabra secreta y la reemplaza en todas las posiciones que aparece en la palabra con las letras ocultadas retornando la nueva palabra que debe mostrarse al jugador ej revisar_letralepidoptero lepidopter_ o debería retornar lepidoptero,4.0,13.0,9.0,9.0,4.0
12,Función buscarTodas,0,0,1,0,0,0,1,0,0,1,1,1,2,2,7,39,551,5.0,programa una función llamada buscartodasab que encuentre todas las apariciones del string b en el string a y retorne un string que representa a una secuencia de índices separada por espacios por ejemplo al ejecutar buscartodastres tristes tigrest debería retornar el string 0 5 9 13 no hay espacios después del número 13,3.0,11.0,6.0,5.0,2.0
13,Cajero Automático Nivel 2,0,0,0,1,0,0,0,1,0,0,1,1,1,1,3,19,275,4.0,ahora tu cajero además de hacer todo lo que debería hacer en el nivel 1 debe distribuir el monto a retirar entre los diferentes billetes que tiene disponibles para ello al principio el saldo de 1000000 estará distribuido en 20 billetes de 20000 40 billetes de 10000 y 40 billetes de 5000 cuando se haga un giro tu cajero además de imprimir los saldos debe imprimir la cantidad de billetes que le entrega a la persona por ejemplo al retirar 45000 podría imprimir billetes 200001 billetes 100003 billetes 50001 puedes distribuir los billetes de otra forma lo importante es que la distribución cuadre con el monto solicitado,3.5,8.0,5.0,5.0,5.0
14,Clase Auto,0,0,1,1,0,0,1,0,1,0,1,1,3,2,11,43,811,3.0,crea la clase auto con los siguientes atributos kilometraje cuando se crea el auto parte en 0 a medida que se usa el kilometraje va aumentando cuenta_kilometros cuando se crea el auto parte en 0 este atributo debe llevar la cuenta de los kilómetros recorridos desde la última vez que se reinició el cuenta kilómetros capacidad_estanque indica la capacidad máxima de combustible que puede almacenar el auto se debe recibir como parámetro en el constructor nivel_estanque indica la cantidad de litros de combustible que tiene actualmente el estanque es menor o igual a la capacidad máxima al crear el auto debe partir en 0 rendimiento número que indica la cantidad de kilómetros por litro que rinde el auto se debe recibir como parámetro en el constructor define en la clase auto los siguientes métodos reiniciar_cuentakilometros reinicia a 0 el valor del cuenta kilómetro andar recibe una velocidad y un tiempo de viaje con esto debe actualizar los litros actuales el kilometraje y el cuenta kilómetros si se pudo terminar con éxito el viaje debe retornar 0 en caso de quedarse sin bencina debe retornar la cantidad de kilómetros que faltó por recorrer autonomia debe retornar cuántos kilómetros puede recorrer el auto con los litros de combustible que posee actualmente llenar_estanque recibe como parámetro la cantidad de litros y actualiza los litros actuales si es que se le intenta echar más combustible de lo que soporta el auto debe retornar una tupla con dos valores la máxima cantidad de combustible que se le puede echar al estanque y false si es que logró llenar el estanque con éxito la tupla debe indicar los litros con los que quedó el auto y true usando la clase auto crea un programa que te indique cuántas veces tendrás que detenerte a cargar combustible en un determinado viaje considera un auto con un estanque de 100 litros y 12 kml de rendimiento,5.25,12.0,11.0,6.0,4.0
15,Twitter,0,0,1,1,0,1,0,1,0,1,1,1,3,5,7,87,855,2.0,el objetivo de este problema es implementar un prototipo de twitter que aunque aún no te permitirá comunicarte con tus compañeros servirá como base para que en el futuro puedas implementar esa funcionalidad tu programa debe aceptar los tweets del usuario limitados a 140 caracteres permitir el ingreso de hashtags creados por la persona los cuales deben almacenarse en una lista junto con el número de veces que han sido mencionados mostrar los tres hashtag más repetidos hasta el momento debes implementar la clase twitter con un atributo llamado trending_topics de tipo lista y con el método tweet que acepta como parámetro un string y actualiza la lista de trending topics de la clase,5.75,13.0,12.0,8.0,4.0
16,Ornitología 1,0,0,1,1,0,0,0,0,1,0,0,0,3,0,8,8,776,1.0,una amigo ornitólogo te ha pedido ayuda para crearle un programa que le permita registrar los avistamientos de aves que hará en una excursión al sur lo primero que te pide es que tu programa pueda manejar la clasificación de las aves decides aplicar tus conocimientos de programación orientada al objeto y crear para ello la clase taxon un taxon tiene dos atributos una categoría y un nombre que son strings un ejemplo de taxon es la clase aves que es donde se clasifican todas las aves crea la clase taxon con los atributos categoria y nombre,4.75,9.0,9.0,5.0,1.0
17,Suma de los N primeros números naturales,0,0,0,1,0,0,0,0,0,0,1,0,1,0,2,2,258,1.0,la suma de los primeros n numeros naturales está dada por nn 12 crea un programa que reciba como parámetro un número n y luego imprima la suma de los n primeros números naturales,1.25,8.0,0.0,3.0,0.0
18,Juego Adivina mi número,0,0,0,1,0,0,0,0,0,0,1,1,1,0,3,3,259,2.0,crea un programa para el juego adivina mi número tú programa debe comenzar por generar aleatoriamente un número entre 1 y 20 el jugador tiene 5 intentos para adivinar el número en cada intento tu programa debe indicar si el número ingresado es menor o mayor que el número secreto imprimiendo el mensaje mi número es menor o mi número es mayor según corresponda cuando el jugador adivina el número o cuando se superan los intentos permitidos tu programa debe terminar e indicar al jugador si adivinó el número debe decir adivinaste mi número era e indicar el número secreto si no adivinó antes que se acabaran los intentos tu programa debe decir no adivinaste mi número era e indicar el número secreto,2.25,6.0,4.0,5.0,6.0
19,Cuenta Corriente en un Banco,0,0,1,1,0,0,1,0,1,0,1,1,3,2,11,43,811,2.0,crea una clase que represente la cuenta corriente del cliente de un banco debe tener un atributo rut y uno saldo los cuales deben ser recibidos como parámetro por el constructor para ser inicializados debe tener un método llamado girar el cual debe retornar true si el saldo de la cuenta permite hacer el giro y false en caso contrario si el giro se puede realizar debe restar el monto a girar del saldo de la cuenta,5.0,12.0,12.0,3.0,3.0
20,Multiplicación de Matrices ,0,0,1,1,0,1,0,0,0,1,1,1,3,4,7,71,839,2.0,Multiplicación de Matrices ,4.25,12.0,8.0,5.0,2.0
21,El antipoema,0,0,1,0,0,0,1,0,0,1,1,1,2,2,7,39,551,5.0,programa la función estadisticas_frases que reciba un string y que retorne el número de palabras el número total de caracteres el largo promedio de las palabras el número de espacios y el número de caracteres de puntuación que no sean letras o espacios para contar el largo de las palabras no debes considerar los caracteres especiales la última palabra del poema imaginarios tiene solamente 11 caracteres porque los tres puntos no forman parte de la palabra para probar tu programa usa el siguiente fragmento del hombre imaginario de nicanor parra el hombre imaginario vive en una mansión imaginaria rodeada de árboles imaginarios a la orilla de un río imaginario de los muros que son imaginarios penden antiguos cuadros imaginarios irreparables grietas imaginarias que representan hechos imaginarios ocurridos en mundos imaginarios en lugares y tiempos imaginarios todas las tardes tardes imaginarias sube las escaleras imaginarias y se asoma al balcón imaginario a mirar el paisaje imaginario que consiste en un valle imaginario circundado de cerros imaginarios,4.25,12.0,11.0,8.0,4.0
22,Signo del Zodíaco,0,0,0,1,0,0,0,1,0,0,0,1,1,1,1,17,273,2.0,escribe un programa que reciba como parámetro el día y el mes del cumpleaños de una persona como números enteros y que imprima el signo del zodíaco al que pertenece para determinar las fechas de cada signo utiliza la columna tropical zodiac en la tabla de fechas que aparece en este link wikipedia,2.0,9.0,1.0,4.0,1.0
23,Conversor de Decimal a Binario,0,0,0,1,0,0,0,0,0,0,1,0,1,0,2,2,258,3.0,escribe un programa que reciba como entrada un número decimal e imprima el resultado de convertirlo a binario por ejemplo al ingresar el número 33 tu programa debiera imprimir el siguiente mensaje resultado100001,2.25,9.0,1.0,4.0,1.0
24,Clase Vector3D,0,0,1,1,0,0,0,1,1,1,1,1,3,1,15,31,799,2.0,crea la clase vector en tres dimensiones con tres atributos x y z que se reciben como parámetro al crear un objeto de la clase implementa lo siguiente crea un método llamado norma que calcule la norma del vector crea una función llamada suma_vectores que reciba como parámetros dos objetos de la clase vector y los sume retornando un objeto de la clase vector define la operación en la clase vector de forma que si a y b son variables de tipo vector sea válido c a b indicación para realizar esto revisa los videos del tema 7 sección sobrecarga de operadores o este link recuerda que la operación debe retornar un objeto de la clase vector code editor,5.5,13.0,9.0,5.0,3.0
25,Ordenar tres números,0,0,0,1,0,0,0,0,0,0,0,1,1,0,1,1,257,1.0,escribe un programa que reciba tres números enteros y los imprima ordenados de menor a mayor separados por una coma,1.25,8.0,8.0,4.0,0.0
26,Contestador Automático,0,0,0,1,0,0,0,0,0,0,1,1,1,0,3,3,259,2.0,escribe un programa para contestar automáticamente el celular dependiendo de la hora en que llega la llamada y el número de teléfono el número telefónico debe ser representado por un número entero int de 8 cifras por ejemplo 78735653 mientras que la hora es representada por un número entero entre 0 y 23 las reglas que rigen si contestarás o no son las siguientes si la llamada ocurre entre 0000 y 0700 la contestas ya que podría ser una emergencia si ocurre antes de las 1400 no la contestas excepto si el número termina en 909 durante la tarde solamente contestas entre 1700 y 1900 exceptuando un número que comienza por 877 después de las 1900 no contestas el celular el programa debe preguntar al usuario por la hora del día y por el número de celular que llama e imprimir contestar o no contestar en pantalla algunos ejemplos del comportamiento esperado del programa son ejemplo 1 ingrese numero telefonico 77389909 ingrese hora de la llamada 13 resultado contestar ejemplo 2 ingrese numero telefonico 98927674 ingrese hora de la llamada 20 resultado no contestar ejemplo 3 ingrese numero telefonico 87765545 ingrese hora de la llamada 18 resultado no contestar,3.0,9.0,4.0,2.0,0.0
27,Decodificador,0,0,1,1,0,0,1,0,0,1,1,1,3,2,7,39,807,3.0,los computadores representan toda la información usando números incluso las letras de las palabras para hacerlo se utiliza el código ascii que asocia un número a cada letra o símbolo escribe una función llamada decodificar que debe recibir como parámetro un mensaje como string y retornar el mensaje descifrado usando las siguientes reglas el mensaje es una secuencia de números binarios de 8 dígitos separados por comas debes convertir cada número binario a su equivalente decimal luego debes convertir cada número en la letra o símbolo que representa usando la función chr para convertir una letra en su código ascii asociados puedes usar ord una vez que tengas todas las letras debes unirlas y retornarlas como el resultado de la función ej decodificar01101000011011110110110001100001 debe retorna hola,4.5,13.0,10.0,7.0,5.0
28,Encriptador ROT13,0,0,1,0,0,0,1,0,0,1,1,1,2,2,7,39,551,3.0,el encriptador rot13 es un tipo de cifrado llamado de desplazamiento este tipo de cifrados eran usados en tiempos de los romanos para proteger mensajes militares importantes se dice que julio césar usaba este tipo de algoritmo para proteger sus mensajes razón por la cual se le suele llamar cifrado césar a este tipo de codificación crea la función rot13 que reciba una palabra y la retorne encriptada,2.75,9.0,7.0,5.0,3.0
29,Aprobación de Créditos,0,0,0,1,0,0,0,0,0,0,1,1,1,0,3,3,259,2.0,un banco desea implementar una política de atención automatizada de créditos de consumo y te contrata para programar su servicio los postulantes entregarán al banco la siguiente información ingreso en pesos año de nacimiento número de hijos años de pertenencia al banco estado civil s soltero c casado si vive en campo o cuidad u urbano r rural el banco usará las siguientes reglas para decidir la aprobación del crédito con una de ellas que se cumpla se aprueba el crédito si el cliente pertenece más de 10 años al banco y tiene dos o más hijos si el cliente es casado tiene más de tres hijos y tiene entre 45 y 55 años si el cliente posee ingresos superiores a 2500000 es soltero y vive en la ciudad si el ciente tiene ingresos superiores a 3500000 y pertenece al banco por más de 5 años si el cliente vive en el campo es casado y tiene menos de dos hijos tu programa debe preguntar sus datos al cliente procesarlos e imprimir el mensaje aprobado o rechazado según corresponda,3.0,11.0,3.0,3.0,0.0
30,Interpretar Expresiones Matématicas,0,1,0,0,1,1,0,0,0,1,1,1,4,12,7,199,1223,1.0,a través de este buzón puedes entregar el programa que hayas creado para resolver el ejercicio planteado en clases respecto a la interpretación de expresiones matemáticas la revisión será manual y el puntaje posible es entre 1 y 3 puntos,0.0,0.0,0.0,0.0,0.0
31,Carro de Compras,0,0,1,0,0,0,1,0,0,1,1,1,2,2,7,39,551,3.0,amazon quiere probar el uso de python para su nuevo carro de compras para hacerlo te pide hacer un prototipo en el que los productos estén representados por números del 1 al 5 1 juego pokemon x para nintendo 3ds usd 3377 2 nintendo 3ds xl usd 203 3 juego mario kart 7 para nintendo 3ds usd 2758 4 playstation 4 usd 34800 5 fifa 16 playstation 4 usd 5119 si se agregan los productos 1 2 y 3 al carro se aplica un descuento del 20 del valor conjunto lo mismo ocurre si se agregan los productos 4 y 5 al carro se les aplica un descuento del 15 tu programa debe permitir agregar productos al carro mostrarlos y hacer el checkout para hacerlo debe recibir un string que indica lo que el usuario quiere hacer los productos tu programa debe recibirlos como strings de la forma productocantidad por ejemplo para agregar 2 unidades del producto 5 tu programa recibirá el string 52 para imprimir los productos tu programa recibirá la orden ver para hacer el checkout tu programa recibirá la orden checkout al recibirla tu programa debe imprimir el valor de los productos en el carro considerando los descuentos el precio debe estar redondeado a un decimal importante en este ejercicio tu programa debe recibir los valores con input y luego imprimir el resultado con print como parte de tu programa puedes crear y usar las funciones que necesites,5.5,12.0,12.0,9.0,5.0
32,Cajero Automático Nivel 1,0,0,0,1,0,0,0,0,0,0,1,1,1,0,3,3,259,2.0,tu cajero debe pedir un usuario y una clave para ingresar al principio debe tener 1000000 como saldo inicial tu cajero debe dejar ingresar al usuario 10334151 con la clave 1803 quien tiene al inicio del programa 100000 en su cuenta lo único que se puede hacer en este nivel es retirar dinero de la cuenta corriente tu programa debe validar la clave y el monto a retirar indicando el mensaje clave invalida cuando la clave no corresponde y al tercer intento fallido debe indicar tarjeta bloqueada y salir del programa si la clave es válida debe preguntar por el monto a retirar cuando se hace el retiro de un monto que no es válido debe indicar monto no permitido si el monto se puede retirar debe actualizar los saldos e imprimir el nuevo saldo que quedó en la cuenta corriente y el cajero por ejemplo al retirar 45000 debiera imprimir saldo cuenta55000 saldo cajero955000 tu programa debe repetirse continuamente para salir la persona debe ingresar algo distinto a la letra n code editor,3.25,7.0,5.0,7.0,3.0
33,Alineamiento de Secuencias,0,0,1,0,0,1,0,0,0,1,1,1,2,4,7,71,583,4.0,escribe un programa que dadas dos secuencias de adn representadas mediante string entregue como resultado una forma de alinearlas para el alineamiento puedes insertar el caracter _ solamente en el segundo string de forma de alinearlo con el primero la función debe retornar el string resultante de la alineación del segundo string tu programa recibirá como entradas dos strings y debe imprimir como salida el segundo string modificado para alinearlo con el primero por ejemplo con los strings acctggttctgtagtcaggattacta y tgacgttcagtagtcgatt el segundo string alineado con el primero debiera ser ___tg_______a__c_g__tt_c_agtagtcgatt los underscores _ representan los caracteres que tu programa debiera insertar para hacer el alineamiento,5.5,10.0,8.0,7.0,2.0
34,Ornitología 3,0,0,1,1,0,0,0,0,1,1,0,0,3,0,12,12,780,1.0,para completar tu programa agrega el método incluir que recibe como parámetro un taxon y lo agrega en la lista de subcategorias de otro taxon por ejemplo la clase aves incluye al orden falconiformes que es donde se clasifican los halcones,4.5,11.0,8.0,5.0,1.0
35,Factores Primos,0,0,0,1,0,0,0,1,0,0,1,1,1,1,3,19,275,3.0,crea un programa que imprima la descomposición de factores primos de un número tu programa recibirá como entrada un número entero y debe imprimir cada factor primo del número en una línea separada por ejemplo para el número 22 debiera imprimir 2 11 cuando termines tu programa y lo subas para revisión usa la instrucción input sin un mensaje entre los paréntesis para que solamente se muestre en la salida un número en cada línea,2.75,9.0,2.0,5.0,4.0
36,Pintar Región,0,1,0,0,1,0,0,0,0,1,1,1,4,8,7,135,1159,1.0,a través de este buzón pueden entregar el programa que hayan creado en su grupo para el ejercicio en clases lo que entreguen será revisado en forma manual en forma provisoria la plataforma les entregará un punto por entregar su ejercicio pero el puntaje del ejercicio varía entre 1 y 4 puntos todos los integrantes del grupo deben entregar el ejercicio el puntaje será igual para todos y se calculará a partir de la revisión del programa de uno de los integrantes del grupo,0.0,0.0,0.0,0.0,0.0
37,Jerigonzo,0,0,1,0,0,0,1,0,0,1,1,1,2,2,7,39,551,3.0,crea una función que reciba un texto y retorne el mismo texto traducido a jerigonzo el jerigonzo es un idioma en que después de cada vocal se agrega una p y repite la vocal,3.0,10.0,5.0,7.0,3.0
38,Decodificador,0,0,1,0,0,0,1,0,0,1,1,1,2,2,7,39,551,3.0,los computadores representan toda la información usando números incluso las letras de las palabras para hacerlo se utiliza el código ascii que asocia un número a cada letra o símbolo escribe una función llamada decodificar que debe recibir como parámetro un mensaje como string y retornar el mensaje descifrado usando las siguientes reglas el mensaje es una secuencia de números binarios de 8 dígitos separados por comas debes convertir cada número binario a su equivalente decimal luego debes convertir cada número en la letra o símbolo que representa usando la función chr para convertir una letra en su código ascii asociados puedes usar ord una vez que tengas todas las letras debes unirlas y retornarlas como el resultado de la función ej decodificar01101000011011110110110001100001 debe retorna hola,0.0,0.0,0.0,0.0,0.0
39,Clase Fracción,0,0,1,1,0,0,0,1,1,1,1,1,3,1,15,31,799,2.0,completa la clase fracción con los métodos necesarios para que se pueden sumar restar y dividir fracciones,3.5,8.0,6.0,3.0,2.0
